{
  "self" : "http://www.example.com/jira/rest/api/2/issue/10010/worklog/10000" ,
  "author" : {
    "self" : "http://www.example.com/jira/rest/api/2/user?username=fred" ,
    "name" : "fred" ,
    "displayName" : "Fred F. User" ,
    "active" : false
  } ,
  "updateAuthor" : {
    "self" : "http://www.example.com/jira/rest/api/2/user?username=fred" ,
    "name" : "fred" ,
    "displayName" : "Fred F. User" ,
    "active" : false
  } ,
  "comment" : "I did some work here." ,
  "visibility" : {
    "type" : "group" ,
    "value" : "jira-developers"
  } ,
  "started" : "2014-05-27T08:32:06.865+0000" ,
  "timeSpent" : "3h 20m" ,
  "timeSpentSeconds" : 12000 ,
  "id" : "100028"
}